{
  "schema_version": "0.1",
  "kind": "corpus_loop_v0_manifest",
  "loop_id": "watson-cyc-semantic-web-chronos-v0",
  "source_corpus": "SocioProphet/sociosphere#334",
  "components": [
    {
      "plane": "evidence",
      "repo": "SocioProphet/sherlock-search",
      "issue_ref": "SocioProphet/sherlock-search#56",
      "merged_ref": "SocioProphet/sherlock-search#58",
      "artifact_refs": [
        "schemas/source-quality-answer-trace.v0.schema.json",
        "fixtures/source-quality-answer-trace/valid.confirmed-bibliographic.json",
        "tools/validate_source_quality_answer_trace.py"
      ]
    },
    {
      "plane": "ontology",
      "repo": "SocioProphet/ontogenesis",
      "issue_ref": "SocioProphet/ontogenesis#89",
      "merged_ref": "SocioProphet/ontogenesis#103",
      "artifact_refs": [
        "Platform/corpus-event-semantics.ttl",
        "shapes/corpus-event-semantics.shacl.ttl",
        "scripts/validate_corpus_event_semantics.py"
      ]
    },
    {
      "plane": "policy",
      "repo": "SocioProphet/policy-fabric",
      "issue_ref": "SocioProphet/policy-fabric#78",
      "merged_ref": "SocioProphet/policy-fabric#85",
      "artifact_refs": [
        "contracts/governed-action-policy-decision.v0.schema.json",
        "examples/governed-action-policy/valid.low-risk-allow.json",
        "tools/validate_governed_action_policy_decision.py"
      ]
    },
    {
      "plane": "runtime",
      "repo": "SocioProphet/agentplane",
      "issue_ref": "SocioProphet/agentplane#162",
      "merged_ref": "SocioProphet/agentplane#184",
      "artifact_refs": [
        "schemas/bounded-action-loop.v0.schema.json",
        "tests/fixtures/bounded-action-loop/valid.record-event-instance.json",
        "tools/check_bounded_action_loop.py"
      ]
    },
    {
      "plane": "ledger",
      "repo": "SocioProphet/model-governance-ledger",
      "issue_ref": "SocioProphet/model-governance-ledger#19",
      "merged_ref": "SocioProphet/model-governance-ledger#20",
      "artifact_refs": [
        "schemas/governance-audit-record.v0.schema.json",
        "examples/governance-audit-record.valid.json",
        "tools/check_record_v0.py"
      ]
    }
  ],
  "positive_acceptance": [
    "Evidence carrier validates",
    "Event semantics carrier validates",
    "Policy decision carrier validates",
    "Bounded action loop carrier validates",
    "Ledger record carrier validates"
  ],
  "negative_acceptance": [
    "Event without provenance fails",
    "Claim without evidence fails",
    "Research-only evidence cannot produce implementation-safe admission",
    "Loop without policy decision fails",
    "Ledger record without policy decision fails"
  ],
  "sociosphere_boundary": {
    "owns_coordination": true,
    "owns_downstream_implementation": false
  }
}
